De ref,school name,management type,constituency,total enrolment,nearest_same_management_distance,nearest_same_management_school,area
3016225,"Woodlawn Primary School, Carrickfergus",Controlled,East Antrim,135.0,0.5046465235534828,"Sunnylands Primary School, Carrickfergus",0.8000634752122392
3016244,"Ashgrove Primary School, Newtownabbey",Controlled,Belfast North,362.0,0.8380289891548278,"Carnmoney Primary School, Newtownabbey",2.2063172309337635
3016249,"Earlview Primary School, Newtownabbey",Controlled,South Antrim,205.0,0.7497419500481067,"Carnmoney Primary School, Newtownabbey",1.7659300450925242
3016252,"Ballysally Primary School, Coleraine",Controlled,East Londonderry,282.0,0.8426010374870428,"Millburn Primary School, Coleraine",2.2304569829298475
3016257,"Oakfield Primary School, Carrickfergus",Controlled,East Antrim,278.0,1.4501058136177194,"Victoria Primary School, Carrickfergus",6.606162616871273
3016260,Cloughmills Primary School,Controlled,North Antrim,89.0,4.810825251479191,Clough Primary School,72.70914478259891
3016264,"The Irish Society's Primary School, Coleraine",Controlled,East Londonderry,417.0,1.264486003413124,"Killowen Primary School, Coleraine",5.023170571285628
3016269,"Cairncastle Primary School, Ballygally",Controlled,East Antrim,66.0,4.310050856224416,"Linn Primary School, Larne",58.359916513918186
3016283,"Knockloughrim Primary School, Magherafelt",Controlled,Mid Ulster,126.0,4.631211438631306,Castledawson Primary School,67.38125430677137
3016414,"Fairview Primary School, Ballyclare",Controlled,South Antrim,498.0,0.4306325166274827,Ballyclare Primary School,0.582590652776158
3016440,Portglenone Primary School,Controlled,North Antrim,134.0,6.145204699146342,"The Diamond Primary School, Cullybackey",118.63766233325782
3016444,"Hazelbank Primary School, Ballymena",Controlled,North Antrim,162.0,6.780700090564141,"Broughshane Primary School, Ballymena",144.44381313255573
3016447,"Balnamore Primary School, Ballymoney",Controlled,North Antrim,16.0,3.0214014707009773,"Culcrow Primary School, Aghadowey",28.679181022618515
3016594,"Bushvalley Primary School, Ballymoney",Controlled,North Antrim,173.0,3.6923656884009417,"William Pinkerton Memorial Primary School, Ballymoney",42.831105688651476
3016705,Islandmagee Primary School,Controlled,East Antrim,138.0,5.269909631691102,"Glynn Primary School, Larne",87.24814632416177
3030434,"Creggan Primary School, Randalstown",Catholic Maintained,South Antrim,107.0,2.6860541360764025,Moneynick Primary School,22.66623543626699
3030438,"Millquarter Primary School, Toomebridge",Catholic Maintained,North Antrim,125.0,5.188440782972305,"St Oliver Plunkett's Primary School, Toomebridge",84.57141586506309
3030547,"St Patrick's Primary School, Portrush",Catholic Maintained,East Londonderry,69.0,4.894292124838246,"St Colum's Primary School, Portstewart",75.25401014225075
3030588,"St Mary's Primary School, Rathlin",Catholic Maintained,North Antrim,12.0,10.472414966031613,"St Patrick's & St Brigid's Primary School, Ballycastle",344.5431008619038
3030621,"St Mary's Primary School, Portglenone",Catholic Maintained,North Antrim,244.0,2.905365563527178,"St Mary's Primary School, Greenlough",26.518651867619706
3030688,"Mount St Michael's Primary School, Randalstown",Catholic Maintained,South Antrim,382.0,4.694367277305452,"Creggan Primary School, Randalstown",69.23154162265664
3030708,"Glenann Primary School, Cushendall",Catholic Maintained,East Antrim,55.0,3.20878485830876,"St Mary's Primary School, Cushendall",32.346781277684016
3030719,"St Olcan's Primary School, Ballymoney",Catholic Maintained,North Antrim,77.0,7.740439181269063,"St Patrick's Primary School, Loughgiel",188.2266348596254
3030815,Moneynick Primary School,Catholic Maintained,South Antrim,59.0,2.6860541360764025,"Creggan Primary School, Randalstown",22.66623543626699
3030832,"St Comgall's Primary School, Antrim",Catholic Maintained,South Antrim,500.0,2.6392363793624116,"St Joseph's Primary School, Antrim",21.882979349652132
3030894,"St Mary's Primary School, Cushendall",Catholic Maintained,East Antrim,142.0,2.2306616312209497,"St Patrick's Primary School, Glenariff",15.632097930280036
3030898,"St Anne's Primary School, Loughgiel",Catholic Maintained,North Antrim,91.0,3.6379556962545587,"St Patrick's Primary School, Loughgiel",41.57810430138297
3030900,"St Anthony's Primary School, Larne",Catholic Maintained,East Antrim,71.0,1.5243480881315343,"St MacNissi's Primary School, Larne",7.299921223460229
3032018,"St Brigid's Primary School, Tirkane",Catholic Maintained,Mid Ulster,263.0,2.9506872284697896,"St Patrick's Primary School, Maghera",27.35244960386685
3032109,"New Row Primary School, Castledawson",Catholic Maintained,Mid Ulster,198.0,3.3832281256949774,"Anahorish Primary School, Toomebridge",35.959400091910894
3032185,"St Trea's Primary School, Magherafelt",Catholic Maintained,Mid Ulster,106.0,3.78953493585365,"Anahorish Primary School, Toomebridge",45.115077015746834
3032197,"Knocknagin Primary School, Dessertmartin",Catholic Maintained,Mid Ulster,74.0,2.4575897572415246,"St Columb's Primary School, Desertmartin",18.974426108182936
3032202,"St Columba's Primary School, Garvagh",Catholic Maintained,East Londonderry,101.0,5.056013604925362,St Patrick's & St Joseph's Primary School,80.30939245924093
3032205,"St Columb's Primary School, Desertmartin",Catholic Maintained,Mid Ulster,77.0,2.4575897572415246,"Knocknagin Primary School, Dessertmartin",18.974426108182936
3032218,"Crossroads Primary School, Kilrea",Catholic Maintained,Mid Ulster,108.0,4.9130408611883905,"St Columba's Primary School, Kilrea",75.83167080701227
3032231,"St Colum's Primary School, Portstewart",Catholic Maintained,East Londonderry,150.0,4.894292124838246,"St Patrick's Primary School, Portrush",75.25401014225075
3032246,"St John Bosco Primary School, Ballynease",Catholic Maintained,Mid Ulster,107.0,3.0179145951691697,"St Mary's Primary School, Portglenone",28.613024285636815
3032257,"Anahorish Primary School, Toomebridge",Catholic Maintained,Mid Ulster,186.0,3.3832281256949774,"New Row Primary School, Castledawson",35.959400091910894
3032268,"St Columba's Primary School, Straw",Catholic Maintained,Mid Ulster,145.0,2.074003166021177,"St Mary's Primary School, Draperstown",13.513526658679416
3032271,"St Eoghan's Primary School, Magherafelt",Catholic Maintained,Mid Ulster,131.0,3.928648729860169,"St Columba's Primary School, Straw",48.48822330865412
3032273,"St Mary's Primary School, Draperstown",Catholic Maintained,Mid Ulster,177.0,2.074003166021177,"St Columba's Primary School, Straw",13.513526658679416
3032274,"St John's Primary School, Swatragh",Catholic Maintained,Mid Ulster,225.0,4.369680839358461,"St Brigid's Primary School, Tirkane",59.985917706720585
3032275,"St Mary's Primary School, Greenlough",Catholic Maintained,Mid Ulster,160.0,2.905365563527178,"St Mary's Primary School, Portglenone",26.518651867619706
3032281,"St Mary's Primary School, Bellaghy",Catholic Maintained,Mid Ulster,208.0,4.269542414243975,"New Row Primary School, Castledawson",57.268068691095976
3032285,St Patrick's & St Joseph's Primary School,Catholic Maintained,East Londonderry,155.0,5.056013604925362,"St Columba's Primary School, Garvagh",80.30939245924093
3032297,"St Malachy's Primary School, Coleraine",Catholic Maintained,East Londonderry,170.0,1.1411574020120088,"St John's Primary School, Coleraine",4.091108296318795
3033303,"St Oliver Plunkett's Primary School, Toomebridge",Catholic Maintained,South Antrim,206.0,3.442025250931657,"Anahorish Primary School, Toomebridge",37.22013780373262
3033313,"St Bernard's Primary School, Newtownabbey",Catholic Maintained,Belfast North,624.0,1.1913762423907746,St Mary's-on-the-Hill Primary School,4.459105458363362
3033317,"St John's Primary School, Carnlough",Catholic Maintained,East Antrim,146.0,8.468547553825122,"St Patrick's Primary School, Glenariff",225.30339390712103
3033320,"St Patrick's Primary School, Rasharkin",Catholic Maintained,North Antrim,242.0,5.3581788753506965,"St Columba's Primary School, Kilrea",90.19537911454432
3033326,"St Brigid's Primary School, Ballymoney",Catholic Maintained,North Antrim,209.0,9.784337589398861,"St Joseph's Primary School, Dunloy",300.75491280232364
3033709,"St John's Primary School, Coleraine",Catholic Maintained,East Londonderry,166.0,1.1411574020120088,"St Malachy's Primary School, Coleraine",4.091108296318795
3036026,"St Joseph's Primary School, Crumlin",Catholic Maintained,South Antrim,541.0,4.11385444451976,"Ballymacrickett Primary School, Glenavy",53.167680695042115
3036039,"St Mary's Primary School, Glenview",Catholic Maintained,Mid Ulster,274.0,1.954892948793548,"St Patrick's Primary School, Maghera",12.005930720719604
3036046,St Mary's-on-the-Hill Primary School,Catholic Maintained,Belfast North,342.0,1.1913762423907746,"St Bernard's Primary School, Newtownabbey",4.459105458363362
3036050,"St Joseph's Primary School, Antrim",Catholic Maintained,South Antrim,345.0,2.6392363793624116,"St Comgall's Primary School, Antrim",21.882979349652132
3036100,"St James Primary School, Newtownabbey",Catholic Maintained,East Antrim,261.0,2.8879294485472693,"St MacNissi's Primary School, Newtownabbey",26.20131155766547
3036103,"St Brigid's Primary School, Knockloughrim",Catholic Maintained,Mid Ulster,263.0,5.709313627974085,"St Mary's Primary School, Bellaghy",102.4041775559232
3036131,"St Patrick's Primary School, Glenariff",Catholic Maintained,East Antrim,83.0,2.2306616312209497,"St Mary's Primary School, Cushendall",15.632097930280036
3036139,"St MacNissi's Primary School, Newtownabbey",Catholic Maintained,South Antrim,172.0,1.827961945027707,St Mary's-on-the-Hill Primary School,10.497458663725395
3036147,"St Columba's Primary School, Kilrea",Catholic Maintained,East Londonderry,258.0,4.9130408611883905,"Crossroads Primary School, Kilrea",75.83167080701227
3036154,"St Patrick's Primary School, Loughgiel",Catholic Maintained,North Antrim,154.0,3.6379556962545587,"St Anne's Primary School, Loughgiel",41.57810430138297
3036243,"St Joseph's Primary School, Dunloy",Catholic Maintained,North Antrim,312.0,5.980445297372616,"St Patrick's Primary School, Rasharkin",112.36134191011355
3036268,"St Ciaran's Primary School, Cushendun",Catholic Maintained,East Antrim,44.0,3.9391540517244916,"Glenann Primary School, Cushendall",48.74788788136499
3036292,"St Patrick's Primary School, Maghera",Catholic Maintained,Mid Ulster,171.0,1.954892948793548,"St Mary's Primary School, Glenview",12.005930720719604
3036559,"St Patrick's & St Brigid's Primary School, Ballycastle",Catholic Maintained,North Antrim,448.0,9.080080922162912,"St Olcan's Primary School, Ballymoney",259.01762129191883
3036562,"Holy Family Primary School, Magherafelt",Catholic Maintained,Mid Ulster,568.0,3.760798318390473,"New Row Primary School, Castledawson",44.43344239532088
3036563,"St Nicholas' Primary School, Carrickfergus",Catholic Maintained,East Antrim,131.0,7.227502475449454,"St James Primary School, Newtownabbey",164.10672209680192
3036575,"St MacNissi's Primary School, Larne",Catholic Maintained,East Antrim,169.0,1.5243480881315343,"St Anthony's Primary School, Larne",7.299921223460229
3036666,"St Colmcilles Primary School, Ballymena",Catholic Maintained,North Antrim,425.0,1.5344534810327704,"St Brigid's Primary School, Ballymena",7.397029082829307
3036679,"St Brigid's Primary School, Ballymena",Catholic Maintained,North Antrim,387.0,1.5344534810327704,"St Colmcilles Primary School, Ballymena",7.397029082829307
3036683,"St Paul's Primary School, Ahoghill",Catholic Maintained,North Antrim,26.0,6.176600899108734,"St Colmcilles Primary School, Ballymena",119.8530121833632
3036704,"Mary Queen of Peace Primary School, Cargan",Catholic Maintained,North Antrim,227.0,8.008561649728493,"St Anne's Primary School, Loughgiel",201.49251556852218
3046653,"Gaelscoil An Chaistil, Ballycastle",Other Maintained,North Antrim,100.0,46.47575340751398,"Gaelscoil Leim An Mhadaidh, Limavady",6785.826480893135
3046678,"Gaelscoil Na Speirini, Draperstown",Other Maintained,Mid Ulster,79.0,13.301260209782624,"Gaelscoil an tSeanchai, Magherafelt",555.8216406329009
3046684,"Gaelscoil Ghleann Darach, Crumlin",Other Maintained,South Antrim,99.0,14.341125187435214,Scoil Na Fuiseoige,646.1246746289777
3046685,"Gaelscoil Eanna, Glengormley",Other Maintained,Belfast North,213.0,5.77403067977809,Bunscoil Bheann Mhadagain,104.73890927713315
3046691,"Gaelscoil an tSeanchai, Magherafelt",Other Maintained,Mid Ulster,128.0,13.301260209782624,"Gaelscoil Na Speirini, Draperstown",555.8216406329009
3050519,"Carnlough Integrated Primary School, Ballymena",Controlled Integrated,East Antrim,27.0,3.657256834093864,"Seaview Integrated Primary School, Glenarm",42.02045909062122
3050791,"Glengormley Integrated Primary School, Newtownabbey",Controlled Integrated,Belfast North,268.0,3.271241014740789,Mallusk Controlled Integrated Primary School,33.61823883265638
3050841,"Central Integrated Primary School, Carrickfergus",Controlled Integrated,East Antrim,140.0,6.702302101604991,"Glencraig Integrated Primary School, Holywood",141.12302322662256
3050859,Crumlin Integrated Primary School,Controlled Integrated,South Antrim,150.0,11.190044570625282,Six Mile Integrated Primary School,393.38111358652736
3050866,Ballymoney Model Controlled Integrated Primary School,Controlled Integrated,North Antrim,363.0,17.431473718706034,"Carhill Integrated Primary School, Garvagh",954.592644447411
3050899,"Seaview Integrated Primary School, Glenarm",Controlled Integrated,East Antrim,108.0,3.657256834093864,"Carnlough Integrated Primary School, Ballymena",42.02045909062122
3052071,"Carhill Integrated Primary School, Garvagh",Controlled Integrated,East Londonderry,77.0,17.431473718706034,Ballymoney Model Controlled Integrated Primary School,954.592644447411
3053333,Ballycastle Integrated Primary School,Controlled Integrated,North Antrim,200.0,22.827642667267995,Ballymoney Model Controlled Integrated Primary School,1637.0879208055535
3056231,Six Mile Integrated Primary School,Controlled Integrated,South Antrim,247.0,2.4708084903021614,Round Tower Integrated Primary School,19.179092012945862
3056248,Round Tower Integrated Primary School,Controlled Integrated,South Antrim,252.0,2.4708084903021614,Six Mile Integrated Primary School,19.179092012945862
3056708,Mallusk Controlled Integrated Primary School,Controlled Integrated,South Antrim,123.0,3.271241014740789,"Glengormley Integrated Primary School, Newtownabbey",33.61823883265638
3066544,"Mill Strand Integrated Primary School, Portrush",GMI,East Londonderry,409.0,25.482433496495183,"Roe Valley Integrated Primary School, Limavady",2040.0070657194901
3066551,"Braidside Integratead Primary School, Ballymena",GMI,North Antrim,319.0,14.28222049354564,"Maine Integrated Primary School, Randalstown",640.8277941718621
3066561,"Corran Integrated Primary School, Larne",GMI,East Antrim,220.0,16.29020592478576,"Acorn Integrated Primary School, Carrickfergus",833.6869842575394
3066568,"Acorn Integrated Primary School, Carrickfergus",GMI,East Antrim,223.0,11.885493498025351,"Hazelwood Integrated Primary School, Newtownabbey",443.7969470104273
3066613,"Spires Integrated Primary School, Magherafelt",GMI,Mid Ulster,210.0,13.636574686110624,"Phoenix Integrated Primary School NU, Cookstown",584.1985349537739
3066652,"Maine Integrated Primary School, Randalstown",GMI,South Antrim,152.0,14.28222049354564,"Braidside Integratead Primary School, Ballymena",640.8277941718621
4010512,"McKinney Primary School, Dundrod",Controlled,South Antrim,158.0,3.863330986681969,"Straidhavern Primary School, Crumlin",46.8892954962739
4010720,"Ballycarrickmaddy Primary School, Lisburn",Controlled,South Antrim,196.0,5.47545925728694,"Ballymacash Primary School, Lisburn",94.18700260191905
4010743,"Largymore Primary School, Lisburn",Controlled,Lagan Valley,194.0,1.1086982150065634,"Brownlee Primary School, Lisburn",3.861682546827963
4010762,"Brownlee Primary School, Lisburn",Controlled,Lagan Valley,198.0,0.7880178940256811,Lisburn Central Primary School,1.950841705702232
4010788,Dunmurry Primary School,Controlled,Lagan Valley,217.0,0.6780044605177582,"Seymour Hill Primary School, Belfast",1.4441588792393127
4010807,Lisburn Central Primary School,Controlled,Lagan Valley,213.0,0.6411068722340527,"Tonagh Primary School, Lisburn",1.2912511972324041
4010882,"Seymour Hill Primary School, Belfast",Controlled,Lagan Valley,254.0,0.6780044605177582,Dunmurry Primary School,1.4441588792393127
4010885,"Tonagh Primary School, Lisburn",Controlled,Lagan Valley,228.0,0.6411068722340527,Lisburn Central Primary School,1.2912511972324041
4011265,"Ballyvester Primary School, Donaghadee",Controlled,North Down,116.0,2.254854816171231,Donaghadee Primary School,15.973020200431044
4011300,"Greyabbey Primary School, Newtownards",Controlled,Strangford,78.0,4.794330943254494,"Ballywalter Primary School, Ballywater",72.21142098042075
4011310,"Carrickmannon Primary School, Ballygowan",Controlled,Strangford,87.0,2.441649623013905,"Alexander Dickson Primary School, Ballygowan",18.729084895973706
4011345,Newtownards Model Primary School,Controlled,Strangford,396.0,0.3633788039822893,Regent House Preparatory,0.4148289478742653
4011373,"Kirkistown Primary School, Newtownards",Controlled,Strangford,56.0,2.553529986095516,"Portavogie Primary School, Newtownards",20.484803246494362
4011462,"Castle Gardens Primary School, Newtownards",Controlled,Strangford,328.0,0.8598204996393717,"Abbey Primary School, Newtownards",2.32255209055378
4011488,"Victoria Primary School, Ballyhalbert",Controlled,Strangford,105.0,4.064812494908683,"Portavogie Primary School, Newtownards",51.90759488137801
4011507,"Portavogie Primary School, Newtownards",Controlled,Strangford,219.0,2.553529986095516,"Kirkistown Primary School, Newtownards",20.484803246494362
4011566,"Ballywalter Primary School, Ballywater",Controlled,Strangford,157.0,4.794330943254494,"Greyabbey Primary School, Newtownards",72.21142098042075
4011567,Ballynahinch Primary School,Controlled,Strangford,235.0,2.6514248833202303,"Spa Primary School, Ballynahinch",22.08556572393286
4011578,"Derryboy Primary School, Crossgar",Controlled,Strangford,75.0,4.981840959752678,"Glasswater Primary School, Downpatrick",77.97036920788335
4011584,"Carr Primary School, Lisburn",Controlled,Lagan Valley,90.0,3.6148272933050554,"Carryduff Primary School, Belfast",41.05111693853687
4011587,Dundonald Primary School,Controlled,Belfast East,858.0,0.7086429249136602,"Brooklands Primary School, Belfast",1.577628646884797
4011588,Comber Primary School,Controlled,Strangford,370.0,1.9125901436933679,"Andrews Memorial Primary School, Newtownards",11.491949249860573
4011606,"Gilnahirk Primary School, Belfast",Controlled,Belfast East,412.0,1.5191392155407721,"Braniel Primary School, Belfast",7.250117122850933
4011608,Anahilt Primary School,Controlled,Lagan Valley,149.0,4.6622202284493515,Riverdale Primary School,68.28659241206188
4011619,Dromara Primary School,Controlled,Lagan Valley,162.0,4.245456513755855,"Fair Hill Primary School, Dromara",56.62375500264889
4011631,Holywood Primary School,Controlled,North Down,455.0,2.677553112101047,"Knocknagoney Primary School, Belfast",22.522990894421945
4011632,"Cregagh Primary School, Belfast",Controlled,Belfast East,149.0,0.886242375071461,Rosetta Primary School,2.4674871295665723
4011645,"Crawfordsburn Primary School, Bangor",Controlled,North Down,191.0,1.415552369184522,Rathmore Primary School,6.295087262061773
4011646,"Victoria Primary School, Newtownards",Controlled,Strangford,442.0,1.0331239894933748,"Castle Gardens Primary School, Newtownards",3.3531637690022187
4011650,"Ballyholme Primary School, Bangor",Controlled,North Down,620.0,1.0977600179224913,"Towerview Primary School, Bangor",3.785861229121179
4011654,Donaghadee Primary School,Controlled,North Down,444.0,2.254854816171231,"Ballyvester Primary School, Donaghadee",15.973020200431044
4011657,"Lisnasharragh Primary School, Belfast",Controlled,Belfast East,369.0,0.8819466770690968,"Leadhill Primary School, Belfast",2.443624828994806
4011670,"Clandeboye Primary School, Bangor",Controlled,North Down,297.0,0.8148903282306027,"Grange Park Primary School, Bangor",2.0861628113566106
4011674,"Knockbreda Primary School, Belfast",Controlled,Belfast South,142.0,0.6062949226274205,Rosetta Primary School,1.1548291434201416
4011681,Millisle Primary School,Controlled,North Down,228.0,2.8109522461719094,"Ballyvester Primary School, Donaghadee",24.82314522174985
4011683,"Braniel Primary School, Belfast",Controlled,Belfast East,417.0,0.893169464298737,"Leadhill Primary School, Belfast",2.5062108548368323
4011698,Newcastle Primary School,Controlled,South Down,217.0,9.045889155148771,"Cumran Primary School, Downpatrick",257.0705911408324
4011699,Moneyrea Primary School,Controlled,Strangford,253.0,4.141639807282811,"Andrews Memorial Primary School, Newtownards",53.888305195036985
4013013,"Belvoir Park Primary School, Belfast",Controlled,Belfast South,262.0,1.8252395856316193,"Stranmillis Primary School, Belfast",10.466214495873661
4013023,"Bloomfield Primary School, Bangor",Controlled,North Down,423.0,1.2935635718648735,"Ballymagee Primary School, Bangor",5.2568480813368454
4013024,"Cairnshill Primary School, Belfast",Controlled,Belfast South,552.0,1.6707915077420457,"Knockbreda Primary School, Belfast",8.769894946747312
4013043,"Leadhill Primary School, Belfast",Controlled,Belfast East,144.0,0.8819466770690968,"Lisnasharragh Primary School, Belfast",2.443624828994806
4013044,"Carryduff Primary School, Belfast",Controlled,Belfast South,181.0,3.6148272933050554,"Carr Primary School, Lisburn",41.05111693853687
4013045,"Grange Park Primary School, Bangor",Controlled,North Down,390.0,0.8148903282306027,"Clandeboye Primary School, Bangor",2.0861628113566106
4013046,"Alexander Dickson Primary School, Ballygowan",Controlled,Strangford,84.0,2.441649623013905,"Carrickmannon Primary School, Ballygowan",18.729084895973706
4013305,"Harmony Hill Primary School, Lisburn",Controlled,Lagan Valley,659.0,1.337328809297375,"Brownlee Primary School, Lisburn",5.61857617939046
4013334,"Knockmore Primary School, Lisburn",Controlled,Lagan Valley,233.0,1.309018740649958,"Old Warren Primary School, Lisburn",5.383213458797248
4016002,"Kilcooley Primary School, Bangor",Controlled,North Down,241.0,1.1619675978468826,Rathmore Primary School,4.241680064145019
4016004,"Londonderry Primary School, Newtownards",Controlled,Strangford,404.0,1.0943942826338202,"Victoria Primary School, Newtownards",3.762681895371758
4016020,"Carrowdore Primary School, Newtownards",Controlled,Strangford,170.0,3.539642425008389,Millisle Primary School,39.361229546244886
4016067,Rathmore Primary School,Controlled,North Down,551.0,1.0426627780243576,"Grange Park Primary School, Bangor",3.4153688460991054
4016083,"West Winds Primary School, Newtownards",Controlled,Strangford,178.0,1.0438781819886962,Regent House Preparatory,3.423335894138231
4016104,Moira Primary School,Controlled,Lagan Valley,438.0,2.460277669641802,"Maralin Village Primary School, Craigavon",19.01595418322364
4016111,"Towerview Primary School, Bangor",Controlled,North Down,459.0,1.0977600179224913,"Ballyholme Primary School, Bangor",3.785861229121179
4016123,"Spa Primary School, Ballynahinch",Controlled,South Down,200.0,2.6514248833202303,Ballynahinch Primary School,22.08556572393286
4016126,"Andrews Memorial Primary School, Newtownards",Controlled,Strangford,387.0,1.9125901436933679,Comber Primary School,11.491949249860573
4016144,"Old Warren Primary School, Lisburn",Controlled,Lagan Valley,137.0,0.8689197834356728,Lisburn Central Primary School,2.371970280589873
4016145,"Killowen Primary School, Lisburn",Controlled,Lagan Valley,421.0,0.6121882114517676,"Pond Park Primary School, Lisburn",1.177388521398676
4016192,"Kilmaine Primary School, Bangor",Controlled,North Down,659.0,1.12117579362267,"Towerview Primary School, Bangor",3.9490924246054284
4016201,"Academy Primary School, Ballynahinch",Controlled,Strangford,448.0,4.48348368455406,"Carrickmannon Primary School, Ballygowan",63.151120408669506
4016202,Ballinderry Primary School,Controlled,Lagan Valley,267.0,6.355848905762985,Maghaberry Primary School,126.91033821539426
4016235,Downpatrick Primary School,Controlled,South Down,206.0,7.857080349298429,"Glasswater Primary School, Downpatrick",193.94217488955638
4016396,"Killinchy Primary School, Newtownards",Controlled,Strangford,330.0,5.1777762896259905,"Derryboy Primary School, Crossgar",84.22411137407614
4016399,"Abbey Primary School, Newtownards",Controlled,Strangford,605.0,0.8598204996393717,"Castle Gardens Primary School, Newtownards",2.32255209055378
4016401,"Pond Park Primary School, Lisburn",Controlled,Lagan Valley,626.0,0.6121882114517676,"Killowen Primary School, Lisburn",1.177388521398676
4016417,Maghaberry Primary School,Controlled,Lagan Valley,305.0,3.7588705819509753,Moira Primary School,44.38790205748866
4016430,"Ballymagee Primary School, Bangor",Controlled,North Down,413.0,1.1353870159069572,"Kilmaine Primary School, Bangor",4.049838637891952
4016441,"Ballymacash Primary School, Lisburn",Controlled,Lagan Valley,466.0,1.2959062269790727,"Killowen Primary School, Lisburn",5.275905719602669
4016503,"Brooklands Primary School, Belfast",Controlled,Belfast East,595.0,0.7086429249136602,Dundonald Primary School,1.577628646884797
4016615,Riverdale Primary School,Controlled,Lagan Valley,204.0,3.6898488763205872,"Largymore Primary School, Lisburn",42.77273600677005
4016636,Meadow Bridge Primary School,Controlled,Lagan Valley,292.0,4.4873313458872985,"Downshire Primary School, Hillsborough",63.25955768824659
4016649,"Downshire Primary School, Hillsborough",Controlled,Lagan Valley,651.0,4.477285669595522,"Old Warren Primary School, Lisburn",62.976639549268995
4016650,"Cumran Primary School, Downpatrick",Controlled,South Down,200.0,8.91091486390851,Downpatrick Primary School,249.45629136374944
