De ref,school name,management type,constituency,total enrolment,nearest_same_management_distance,nearest_same_management_school,area
4016681,"Glasswater Primary School, Downpatrick",Controlled,South Down,77.0,4.981840959752678,"Derryboy Primary School, Crossgar",77.97036920788335
4030573,"Ballymacward Primary School, Lisburn",Catholic Maintained,South Antrim,89.0,5.21284259406156,St Kieran's Primary School,85.36878397415677
4030823,"Ballymacrickett Primary School, Glenavy",Catholic Maintained,South Antrim,344.0,4.11385444451976,"St Joseph's Primary School, Crumlin",53.167680695042115
4030897,"St Joseph's Primary School, Lisburn",Catholic Maintained,Lagan Valley,385.0,1.622300596257942,"St Aloysius Primary School, Lisburn",8.268229605345184
4031328,"Christ the King Primary School, Drumaness",Catholic Maintained,South Down,70.0,3.8027257459628525,"St Macartan's Primary School, Downpatrick",45.429701453442064
4031350,"St Malachy's Primary School, Kilclief",Catholic Maintained,South Down,36.0,3.533342467880168,"St Mary's Primary School, Ardglass(Dunsford",39.22124174339034
4031485,"St Caolan's Primary School, Saintfield",Catholic Maintained,Strangford,91.0,5.649406378709341,"St Joseph's Primary School, Crossgar",100.26641903724523
4031526,"St Patrick's Primary School, Saul",Catholic Maintained,South Down,184.0,3.923191521708369,"St Brigid's Primary School, Downpatrick",48.353608807228454
4031531,"St Francis' Primary School, Drumaroad",Catholic Maintained,South Down,92.0,3.8859743523878736,"Christ the King Primary School, Drumaness",47.44055187370845
4031550,"St Joseph's Primary School, Crossgar",Catholic Maintained,Strangford,130.0,3.553477561110491,"Holy Family Primary School, Downpatrick",39.66952748060383
4031628,"St Patrick's Primary School, Holywood",Catholic Maintained,North Down,303.0,5.377180462175193,"St Joseph's Primary School, Holland Dr",90.83622902652723
4031660,"St Joseph's Primary School, Carryduff",Catholic Maintained,Belfast South,527.0,2.4748338475448994,"St Ita's Primary School, Belfast",19.241634767879805
4031662,"St Mary's Primary School, Comber",Catholic Maintained,Strangford,84.0,6.109053303105654,"St Finian's Primary School, Newtownards",117.24590997666152
4031663,"St Joseph's Primary School, Carnacaville",Catholic Maintained,South Down,195.0,2.255965063811772,"St Mary's Primary School, Newcastle",15.98875369582668
4031665,"St Patrick's Primary School, Ballynahinch",Catholic Maintained,Strangford,260.0,5.71192808904608,"Christ the King Primary School, Drumaness",102.4979867436333
4031671,"St Patrick's Primary School, Castlewellan",Catholic Maintained,South Down,37.0,1.6568006357521101,"St Malachy's Primary School, Castlewellan",8.62363522395799
4031673,"St Mary's Primary School, Ardglass(Dunsford",Catholic Maintained,South Down,87.0,3.533342467880168,"St Malachy's Primary School, Kilclief",39.22124174339034
4031676,"St Bernards Primary School, Belfast",Catholic Maintained,Belfast South,437.0,1.426068155853932,"St Michael's Primary School, Belfast",6.388963941780943
4033002,"St Mary's Primary School, Aughlisnafin",Catholic Maintained,South Down,88.0,3.8395405419045243,"Sacred Heart Primary School, Newcastle",46.313583752207066
4033005,"St Joseph's Primary School, Strangford",Catholic Maintained,South Down,87.0,1.490257030070602,"St Mary's Primary School, Portaferry",6.977056359451347
4033007,"St Macartan's Primary School, Downpatrick",Catholic Maintained,South Down,171.0,3.8027257459628525,"Christ the King Primary School, Drumaness",45.429701453442064
4033008,"St Anne's Primary School, Donaghadee",Catholic Maintained,North Down,10.0,9.799127752324075,"St Comgall's Primary School, Bangor",301.6648520018781
4033012,"Holy Family Primary School, Downpatrick",Catholic Maintained,South Down,186.0,3.553477561110491,"St Joseph's Primary School, Crossgar",39.66952748060383
4033017,"St Finian's Primary School, Newtownards",Catholic Maintained,Strangford,153.0,5.625343874817345,"St Malachy's Primary School, Bangor",99.41410896573169
4033028,"St Patrick's Primary School, Ballygalget",Catholic Maintained,Strangford,120.0,4.271432196398319,"St Mary's Primary School, Portaferry",57.318775823046565
4033036,"St Mary's Primary School, Killyleagh",Catholic Maintained,Strangford,76.0,6.123718415052582,"St Patrick's Primary School, Saul",117.80949588603671
4033037,"St Joseph's Primary School, Tyrella",Catholic Maintained,South Down,52.0,3.7986370481697533,"Sacred Heart Primary School, Newcastle",45.33206177390358
4033040,"St Brigid's Primary School, Downpatrick",Catholic Maintained,South Down,265.0,0.8823388685876566,"Our Lady & St Patrick Primary School, Downpatrick",2.4457986157898692
4033306,"St Aloysius Primary School, Lisburn",Catholic Maintained,Lagan Valley,448.0,1.622300596257942,"St Joseph's Primary School, Lisburn",8.268229605345184
4033307,"St Colman's Primary School, Lisburn",Catholic Maintained,Lagan Valley,393.0,2.098474754973494,"St Joseph's Primary School, Lisburn",13.834305776850577
4036016,"St Joseph's Primary School, Killough",Catholic Maintained,South Down,59.0,2.3069250467069606,"St Nicholas' Primary School, Downpatrick",16.719251905519105
4036036,"St Malachy's Primary School, Kilcoo",Catholic Maintained,South Down,182.0,3.91875162522808,"St Matthew's Primary School, Magheramayo",48.24422666960736
4036113,"St Nicholas' Primary School, Downpatrick",Catholic Maintained,South Down,167.0,2.3069250467069606,"St Joseph's Primary School, Killough",16.719251905519105
4036133,"Sacred Heart Primary School, Newcastle",Catholic Maintained,South Down,122.0,3.7986370481697533,"St Joseph's Primary School, Tyrella",45.33206177390358
4036146,"St Comgall's Primary School, Bangor",Catholic Maintained,North Down,311.0,1.5633179877574561,"St Malachy's Primary School, Bangor",7.677936617510172
4036148,"St Malachy's Primary School, Bangor",Catholic Maintained,North Down,404.0,1.5633179877574561,"St Comgall's Primary School, Bangor",7.677936617510172
4036182,St Colmcille's Primary School,Catholic Maintained,South Down,368.0,1.1588891892301478,"Our Lady & St Patrick Primary School, Downpatrick",4.219234812389878
4036285,"Good Shepherd Primary School, Belfast",Catholic Maintained,Belfast West,364.0,0.6211582774060459,St Kieran's Primary School,1.2121445872003653
4036428,"St Mary's Primary School, Kircubbin",Catholic Maintained,Strangford,142.0,9.13784845822891,"St Patrick's Primary School, Ballygalget",262.3238487708918
4036454,"St Malachy's Primary School, Castlewellan",Catholic Maintained,South Down,388.0,1.6568006357521101,"St Patrick's Primary School, Castlewellan",8.62363522395799
4036455,"St Patrick's Primary School, Legamaddy",Catholic Maintained,South Down,164.0,3.3211975975017225,St Colmcille's Primary School,34.65287746445405
4036480,St Kieran's Primary School,Catholic Maintained,Belfast West,366.0,0.6211582774060459,"Good Shepherd Primary School, Belfast",1.2121445872003653
4036530,"St Mary's Primary School, Portaferry",Catholic Maintained,Strangford,170.0,1.490257030070602,"St Joseph's Primary School, Strangford",6.977056359451347
4036591,"Our Lady Queen of Peace Primary School, Belfast",Catholic Maintained,Belfast West,369.0,0.7367260230922359,"Holy Evangelist Primary School, Belfast",1.705147268935001
4036618,"Christ The Redeemer Primary School, Dunmurry",Catholic Maintained,Belfast West,685.0,0.7275790782584504,"Holy Evangelist Primary School, Belfast",1.6630690346003254
4036635,"St Mary's Primary School, Newcastle",Catholic Maintained,South Down,381.0,2.255965063811772,"St Joseph's Primary School, Carnacaville",15.98875369582668
4036642,"St Ita's Primary School, Belfast",Catholic Maintained,Belfast South,709.0,2.4748338475448994,"St Joseph's Primary School, Carryduff",19.241634767879805
4036693,"Our Lady & St Patrick Primary School, Downpatrick",Catholic Maintained,South Down,392.0,0.8823388685876566,"St Brigid's Primary School, Downpatrick",2.4457986157898692
4036702,"Holy Evangelist Primary School, Belfast",Catholic Maintained,Belfast West,530.0,0.7275790782584504,"Christ The Redeemer Primary School, Dunmurry",1.6630690346003254
4046600,Scoil Na Fuiseoige,Other Maintained,Belfast West,175.0,3.0054360200463206,Bunscoil Phobal Feirste,28.37689328121106
4046648,"Bunscoil Bheanna Boirche, Castlewellan",Other Maintained,South Down,157.0,20.457311441868086,"Gaelscoil na mBeann, Kilkeel",1314.7615251508273
4051569,"Kircubbin Integrated Primary School, Newtownards",Controlled Integrated,Strangford,196.0,11.5388863104343,Portaferry Integrated Primary School,418.2901727665796
4051601,Portaferry Integrated Primary School,Controlled Integrated,Strangford,65.0,7.867085282590471,"Killyleagh Integrated Primary School, Downpatrick",194.436407821201
4051680,Bangor Central Integrated Primary School,Controlled Integrated,North Down,486.0,6.669716246308177,"Glencraig Integrated Primary School, Holywood",139.75410986946767
4053009,"Annsborough Integrated Primary School, Castlewellan",Controlled Integrated,South Down,32.0,7.700219562207339,"All Children's Integrated Primary School, Newcastle",186.27565111805814
4053020,"Glencraig Integrated Primary School, Holywood",Controlled Integrated,North Down,237.0,6.669716246308177,Bangor Central Integrated Primary School,139.75410986946767
4053308,"Fort Hill Integrated Primary School, Lisburn",Controlled Integrated,Lagan Valley,231.0,9.836938673484607,"Forge Integrated Primary School, Belfast",303.99735184481585
4056541,"All Children's Integrated Primary School, Newcastle",Controlled Integrated,South Down,210.0,7.700219562207339,"Annsborough Integrated Primary School, Castlewellan",186.27565111805814
4056709,"Killyleagh Integrated Primary School, Downpatrick",Controlled Integrated,Strangford,124.0,7.867085282590471,Portaferry Integrated Primary School,194.436407821201
4056710,"Loughries Integrated Primary School, Newtownards",Controlled Integrated,Strangford,90.0,8.71132519901412,Bangor Central Integrated Primary School,238.40662831050577
4066579,"Loughview Integrated Primary School, Belfast",GMI,Belfast South,471.0,6.958576982480066,"Cranmore Integrated Primary School, Belfast",152.1215511136932
4066588,"Cedar Integrated Primary School, Crossgar",GMI,South Down,229.0,8.23016311246879,"Drumlins Integrated Primary School, Ballynahinch",212.79761577600436
4066611,Oakwood Integrated Primary School,GMI,Lagan Valley,213.0,3.553904551862315,"Cranmore Integrated Primary School, Belfast",39.67906154336357
4066644,"Millennium Integrated Primary School, Saintfield",GMI,Strangford,439.0,8.409083432267812,"Loughview Integrated Primary School, Belfast",222.15044910672935
4066668,"Drumlins Integrated Primary School, Ballynahinch",GMI,Strangford,210.0,8.23016311246879,"Cedar Integrated Primary School, Crossgar",212.79761577600436
4066682,"Rowandale Integrated Primary School, Moira",GMI,Lagan Valley,354.0,14.176488925518242,Portadown Integrated Primary School,631.3747922340702
4610063,Regent House Preparatory,Controlled,Strangford,81.0,0.3633788039822893,Newtownards Model Primary School,0.4148289478742653
4620044,"Sullivan Upper Preparatory, Holywood",Voluntary,North Down,176.0,3.9497173982799727,"Campbell College Junior School, Belfast",49.00968585458258
4620050,"Friends' School Preparatory, Lisburn",Voluntary,Lagan Valley,142.0,0.3848377850171478,"Wallace High Preparatory, Lisburn",0.4652702514284842
4620051,"Wallace High Preparatory, Lisburn",Voluntary,Lagan Valley,125.0,0.3848377850171478,"Friends' School Preparatory, Lisburn",0.4652702514284842
5010909,"Foley Primary School, Tassagh",Controlled,Newry And Armagh,153.0,3.13931638409892,"Lisnadill Primary School, Armagh",30.961361199386403
5010992,Lurgan Model Primary School,Controlled,Upper Bann,231.0,1.081814704643501,"Carrick Primary School, Lurgan",3.676678312489377
5011019,"Mullaglass Primary School, Newry",Controlled,Newry And Armagh,91.0,2.527578750969102,"Bessbrook Primary School, Newry",20.070549548252945
5011095,"Mullavilly Primary School, Tandragee",Controlled,Newry And Armagh,113.0,2.284333374709885,"Derryhale Primary School, Portadown",16.39339270725792
5011112,"Hardy Memorial Primary School, Richhill",Controlled,Newry And Armagh,446.0,3.0566691115169404,"Hamiltonsbawn Primary School, Armagh",29.35261034244794
5011115,"The Armstrong Primary School, Armagh",Controlled,Newry And Armagh,487.0,4.864838173812207,"Lisnadill Primary School, Armagh",74.35097521198406
5011116,"Tandragee Primary School, Tandragee",Controlled,Newry And Armagh,354.0,2.729988992719334,"Mullavilly Primary School, Tandragee",23.41378707937927
5011119,Darkley Primary School,Controlled,Newry And Armagh,114.0,5.913191388385286,"Cortamlet Primary School, Altnamackin",109.84840218090115
5011124,"King's Park Primary School, Lurgan",Controlled,Upper Bann,674.0,1.054337660525621,"Dickson Primary School, Lurgan",3.4922820517135635
5011127,"Carrick Primary School, Lurgan",Controlled,Upper Bann,454.0,0.8590516362815944,"Dickson Primary School, Lurgan",2.3184002314398255
5011129,"Hart Memorial Primary School, Portadown",Controlled,Upper Bann,448.0,0.6829472839499751,"Millington Primary School, Portadown",1.4652921976332862
5011132,"Killylea Primary School, Armagh",Controlled,Newry And Armagh,97.0,4.105284866429875,"Churchill Primary School, Caledon",52.946404010860974
5011137,Newtownhamilton Primary School,Controlled,Newry And Armagh,56.0,3.6055356230676026,"Cortamlet Primary School, Altnamackin",40.84034990262102
5011142,"Clare Primary School, Tandragee",Controlled,Newry And Armagh,136.0,4.037389480898696,"Tandragee Primary School, Tandragee",51.20957446813198
5011153,"Lisnadill Primary School, Armagh",Controlled,Newry And Armagh,148.0,3.13931638409892,"Foley Primary School, Tassagh",30.961361199386403
5011157,"Derryhale Primary School, Portadown",Controlled,Newry And Armagh,74.0,2.284333374709885,"Mullavilly Primary School, Tandragee",16.39339270725792
5011161,Mountnorris Primary School,Controlled,Newry And Armagh,112.0,5.103713351652365,Markethill Primary School,81.83185978959725
5011165,Richmount Primary School,Controlled,Upper Bann,98.0,3.7092348095769543,Ballyoran Primary School,43.22336022147089
5011174,"Birches Primary School, Portadown",Controlled,Upper Bann,188.0,4.803007596465057,Orchard County Primary School,72.47303012882601
5011175,"Cortamlet Primary School, Altnamackin",Controlled,Newry And Armagh,74.0,3.6055356230676026,Newtownhamilton Primary School,40.84034990262102
5011179,"Bessbrook Primary School, Newry",Controlled,Newry And Armagh,121.0,2.527578750969102,"Mullaglass Primary School, Newry",20.070549548252945
5011189,"Edenderry Primary School, Portadown",Controlled,Upper Bann,403.0,0.9899836404283467,"Bocombra Primary School, Portadown",3.0789731983061173
5011190,"Tullygally Primary School, Craigavon",Controlled,Upper Bann,269.0,1.1628141592799743,"Carrick Primary School, Lurgan",4.247862940208133
5011520,"Dromore Road Primary School, Warrenpoint",Controlled,South Down,87.0,10.036738989601282,"Windsor Hill Primary School, Newry",316.47188453084357
5011575,Dromore Central Primary School,Controlled,Lagan Valley,697.0,5.84975266844182,"Fair Hill Primary School, Dromara",107.50406370408473
5011594,"Abercorn Primary School, Banbridge",Controlled,Upper Bann,308.0,1.177655554009347,"Edenderry Primary School, Banbridge",4.356988783842824
5011596,"Gilford Primary School, Craigavon",Controlled,Upper Bann,88.0,3.384011786140795,"Moyallon Primary School, Portadown",35.97606064339374
5011598,"Waringstown Primary School, Waringstown",Controlled,Upper Bann,426.0,2.8693489803801375,"Dickson Primary School, Lurgan",25.865246191111837
5011602,"Bleary Primary School, Lurgan",Controlled,Upper Bann,176.0,2.870318194760668,"Waringstown Primary School, Waringstown",25.882722770404744
5011611,"Iveagh Primary School, Newry, Rathfriland",Controlled,South Down,271.0,6.0724194824815045,"Bronte Primary School, Banbridge",115.84396203745273
5011617,"Ballydown Primary School, Banbridge",Controlled,South Down,342.0,1.7143059610047482,"Edenderry Primary School, Banbridge",9.23265363564466
5011649,Kilkeel Primary School,Controlled,South Down,546.0,4.557777515468588,"Brackenagh West Primary School, Kilkeel",65.26135939276665
5011651,Milltown Primary School,Controlled,Upper Bann,54.0,2.6278053314320324,"Edenderry Primary School, Banbridge",21.693830947856547
5011664,"Scarva Primary School, Scarva",Controlled,Upper Bann,59.0,3.763345491537144,Poyntzpass Primary School,44.49365195178207
5011684,"Annalong Primary School, Newry",Controlled,South Down,203.0,4.879903115838923,"Brackenagh West Primary School, Kilkeel",74.81217346238707
5011687,"Maralin Village Primary School, Craigavon",Controlled,Upper Bann,244.0,2.460277669641802,Moira Primary School,19.01595418322364
5012280,Moneymore Primary School,Controlled,Mid Ulster,241.0,4.979779371250278,"Churchtown Primary School, Killybasky",77.90585106744517
5012538,"Churchill Primary School, Caledon",Controlled,Fermanagh And South Tyrone,102.0,4.105284866429875,"Killylea Primary School, Armagh",52.946404010860974
5012615,"Ballytrea Primary School, Stewartstown",Controlled,Mid Ulster,52.0,4.124060881511711,Stewartstown Primary School,53.43182506306096
5012621,Aughnacloy Primary School,Controlled,Fermanagh And South Tyrone,163.0,7.11327511059097,Richmond Primary School,158.9604501625109
5012632,"Donaghmore Primary School, Dungannon",Controlled,Mid Ulster,75.0,3.0460593164572822,"Walker Memorial Primary School, Dungannon",29.14919630871551
5012635,Augher Central Primary School,Controlled,Fermanagh And South Tyrone,74.0,5.479609309960359,"Carntall Primary School, Clogher",94.32983232090784
5012636,Moy Regional Primary School,Controlled,Fermanagh And South Tyrone,69.0,4.557863265094301,"Killyman Primary School, Dungannon",65.26381505882982
5012643,Stewartstown Primary School,Controlled,Mid Ulster,57.0,4.124060881511711,"Ballytrea Primary School, Stewartstown",53.43182506306096
5012646,"Howard Primary School, Dungannon",Controlled,Fermanagh And South Tyrone,323.0,2.365527275313481,Dungannon Primary School,17.579470613806443
5012649,Coagh Primary School,Controlled,Mid Ulster,118.0,4.670724776469951,"Ballytrea Primary School, Stewartstown",68.53594840888482
5012657,"Walker Memorial Primary School, Dungannon",Controlled,Fermanagh And South Tyrone,63.0,3.0460593164572822,"Donaghmore Primary School, Dungannon",29.14919630871551
5012696,"Carntall Primary School, Clogher",Controlled,Fermanagh And South Tyrone,92.0,5.479609309960359,Augher Central Primary School,94.32983232090784
5012719,Newmills Primary School,Controlled,Mid Ulster,108.0,3.5223271632442352,"Bush Primary School, Dungannon",38.977076061547635
5012720,Dungannon Primary School,Controlled,Fermanagh And South Tyrone,320.0,2.365527275313481,"Howard Primary School, Dungannon",17.579470613806443
5012726,Cookstown Primary School,Controlled,Mid Ulster,474.0,4.664705603095412,"Churchtown Primary School, Killybasky",68.3594173728739
5013019,"Edenderry Primary School, Banbridge",Controlled,Upper Bann,395.0,1.177655554009347,"Abercorn Primary School, Banbridge",4.356988783842824
5013702,"Woods Primary School, Magherafelt",Controlled,Mid Ulster,182.0,5.599023553243229,Magherafelt Primary School,98.48599151479581
5016007,"Millington Primary School, Portadown",Controlled,Upper Bann,619.0,0.6829472839499751,"Hart Memorial Primary School, Portadown",1.4652921976332862
5016027,"Drumhillery Primary School, Middletown",Controlled,Newry And Armagh,69.0,8.686545484296289,"Killylea Primary School, Armagh",237.05224288000989
5016065,"Dickson Primary School, Lurgan",Controlled,Upper Bann,238.0,0.8590516362815944,"Carrick Primary School, Lurgan",2.3184002314398255
5016078,Poyntzpass Primary School,Controlled,Newry And Armagh,156.0,3.763345491537144,"Scarva Primary School, Scarva",44.49365195178207
5016079,"The Cope Primary School, Loughgall",Controlled,Newry And Armagh,95.0,5.65523867834613,"Hardy Memorial Primary School, Richhill",100.47355076680208
5016080,"Drumgor Primary School, Craigavon",Controlled,Upper Bann,291.0,1.4446741699140688,"Tullygally Primary School, Craigavon",6.556766056621412
5016088,Fivemiletown Primary School,Controlled,Fermanagh And South Tyrone,213.0,7.462151917255126,"Carntall Primary School, Clogher",174.9355381442436
5016098,"Brackenagh West Primary School, Kilkeel",Controlled,South Down,150.0,4.557777515468588,Kilkeel Primary School,65.26135939276665
5016117,Ballyoran Primary School,Controlled,Upper Bann,284.0,1.0674956059702065,"Hart Memorial Primary School, Portadown",3.57999207133557
5016138,"Bocombra Primary School, Portadown",Controlled,Upper Bann,359.0,0.9899836404283467,"Edenderry Primary School, Portadown",3.0789731983061173
5016141,"Churchtown Primary School, Killybasky",Controlled,Mid Ulster,50.0,4.664705603095412,Cookstown Primary School,68.3594173728739
5016178,Donacloney Primary School,Controlled,Upper Bann,222.0,3.209340358627795,"Waringstown Primary School, Waringstown",32.35798190562667
5016179,"Hamiltonsbawn Primary School, Armagh",Controlled,Newry And Armagh,109.0,3.0566691115169404,"Hardy Memorial Primary School, Richhill",29.35261034244794
5016200,"Queen Elizabeth II Primary School, Pomeroy",Controlled,Mid Ulster,45.0,8.837634465562703,"Orritor Primary School, Cookstown",245.37027072355832
5016221,"Orritor Primary School, Cookstown",Controlled,Mid Ulster,222.0,5.4694665135649,Cookstown Primary School,93.98094511502215
5016224,"Donaghey Primary School, Dungannon",Controlled,Mid Ulster,105.0,3.966202449249742,Newmills Primary School,49.41964592124475
5016391,"Bush Primary School, Dungannon",Controlled,Mid Ulster,205.0,2.73214456723251,Dungannon Primary School,23.4507763040325
5016436,Markethill Primary School,Controlled,Newry And Armagh,301.0,5.103713351652365,Mountnorris Primary School,81.83185978959725
5016451,"Windsor Hill Primary School, Newry",Controlled,Newry And Armagh,205.0,3.753603002006153,"Mullaglass Primary School, Newry",44.26358120882985
5016543,"Moyallon Primary School, Portadown",Controlled,Upper Bann,202.0,3.124055143414103,"Edenderry Primary School, Portadown",30.661066346701197
5016599,"Fair Hill Primary School, Dromara",Controlled,Lagan Valley,259.0,4.245456513755855,Dromara Primary School,56.62375500264889
5016612,"Bronte Primary School, Banbridge",Controlled,South Down,186.0,6.0724194824815045,"Iveagh Primary School, Newry, Rathfriland",115.84396203745273
5016616,"Drumadonnell Primary School, Banbridge",Controlled,South Down,216.0,6.3126564438025285,"Iveagh Primary School, Newry, Rathfriland",125.19130918375745
5016643,Richmond Primary School,Controlled,Fermanagh And South Tyrone,115.0,7.11327511059097,Aughnacloy Primary School,158.9604501625109
5016658,Orchard County Primary School,Controlled,Newry And Armagh,175.0,4.803007596465057,"Birches Primary School, Portadown",72.47303012882601
5016680,"Killyman Primary School, Dungannon",Controlled,Fermanagh And South Tyrone,185.0,3.0739023617669843,"Howard Primary School, Dungannon",29.68451857703504
5030958,"St John's Primary School, Eglish",Catholic Maintained,Newry And Armagh,93.0,5.385576248920427,"Clintyclay Primary School, Dungannon",91.1201090254193
5030972,"St Oliver Plunkett Primary School, Forkhill",Catholic Maintained,Newry And Armagh,142.0,2.3117167901948417,"Dromintee Primary School, Newry",16.788779582495028
5030975,"St Malachy's Primary School, Ballymoyer",Catholic Maintained,Newry And Armagh,69.0,3.840307049114337,"St Teresa's Primary School, Tullyherron",46.3320772354581
5031070,"St Michael's Primary School, Newtownhamilton",Catholic Maintained,Newry And Armagh,71.0,4.813081001768002,"St Malachy's Primary School, Ballymoyer",72.77734602375584
5031080,"Clintyclay Primary School, Dungannon",Catholic Maintained,Fermanagh And South Tyrone,96.0,3.5034205074517435,"Laghey Primary School, Dungannon",38.55976765027808
5031086,"Clonalig Primary School, Crossmaglen",Catholic Maintained,Newry And Armagh,171.0,2.711029135541127,"St Patrick's Primary School, Crossmaglen",23.08969747018539
5031088,"Dromintee Primary School, Newry",Catholic Maintained,Newry And Armagh,160.0,2.3117167901948417,"St Oliver Plunkett Primary School, Forkhill",16.788779582495028
5031103,"Tannaghmore Primary School, Lurgan",Catholic Maintained,Upper Bann,601.0,1.1327309851453595,"St Teresa's Primary School, Lurgan",4.030913083131614
5031107,"St Teresa's Primary School, Tullyherron",Catholic Maintained,Newry And Armagh,61.0,3.840307049114337,"St Malachy's Primary School, Ballymoyer",46.3320772354581
5031108,"Clea Primary School, Keady",Catholic Maintained,Newry And Armagh,116.0,2.440459547682356,"St Francis of Assisi Primary School, Keady",18.710831998586098
5031110,Armagh Christian Brothers Primary School,Catholic Maintained,Newry And Armagh,550.0,0.5490516713288793,"St Malachy's Primary School, Armagh",0.9470574144058328
5031126,"Mount St Catherine's Primary School, Armagh",Catholic Maintained,Newry And Armagh,151.0,0.3811668446749796,"St Malachy's Primary School, Armagh",0.45643622704068726
5031130,"St Moninna's Primary School, Cloughoge",Catholic Maintained,Newry And Armagh,462.0,1.4902323809278957,"St Malachy's Primary School, Carnagat",6.976825557606934
5031133,"St Malachy's Primary School, Armagh",Catholic Maintained,Newry And Armagh,191.0,0.3811668446749796,"Mount St Catherine's Primary School, Armagh",0.45643622704068726
5031135,"St Oliver's Primary School, Carrickrovaddy",Catholic Maintained,Newry And Armagh,52.0,3.4797809301920033,"St Patrick's Primary School, Cullyhanna",38.041153755231825
5031138,"St Joseph's Primary School, Madden",Catholic Maintained,Newry And Armagh,177.0,4.753987502159819,"St Francis of Assisi Primary School, Keady",71.00124171965678
5031148,"St Patrick's Primary School, Crossmaglen",Catholic Maintained,Newry And Armagh,493.0,2.711029135541127,"Clonalig Primary School, Crossmaglen",23.08969747018539
5031154,"St Michael's Primary School, Killean",Catholic Maintained,Newry And Armagh,129.0,3.605807685066555,"Jonesborough Primary School, Newry",40.84651349527303
